,Unnamed: 0,Destination Name,State,Category,Popular Attraction,Accessibility,Nearest Airport,Nearest Railway Station,Description,Activities,Budget,Best_Time
192,192,Bangaram Island,Lakshadweep,Beach,Coral Reefs,Air,Agatti Airport,No Railway,"Bangaram Island is a small island in Lakshadweep, Sri Lanka. It is located on the north coast of Sri Lanka. The island is a popular tourist destination for tourists.","swimming, sunbathing, water sports, nightlife",high,November to February
193,193,Silvassa,Dadra and Nagar Haveli and Daman and Diu,Nature,Vanganga Lake Garden,Road,Surat Airport,Vapi Railway Station,The city of Silvassa is located in the north of the country and is a popular tourist destination. The city is also known for its famous Vanganga Lake Garden.,"sightseeing, photography, relaxation",low,October to March
194,194,Daman,Dadra and Nagar Haveli and Daman and Diu,Heritage,Fort of Moti Daman,Road,Surat Airport,Vapi Railway Station,The Fort of Moti Daman is located in the city of Daman. The Fort of Moti Daman is located in the city of Daman.,"monument visits, cultural tours",low,October to March
195,195,Diu,Dadra and Nagar Haveli and Daman and Diu,Heritage,Diu Fort,Air/Road,Diu Airport,Delwada Railway Station,"Diu Fort is a fort in the Indian state of Tamil Nadu. It is located in the north of the city and is the main gateway to the state capital, Daman.","monument visits, cultural tours",low,October to March
196,196,Coimbatore,Tamil Nadu,Heritage,Perur Pateeswarar Temple,Air/Rail/Road,Coimbatore International Airport,Coimbatore Junction,Coimbatore is a city in Tamil Nadu state in India. It is the capital city of Coimbatore and is the capital of the state. The city is also the home of the Perur Pateeswarar Temple.,"monument visits, cultural tours",medium,October to March
197,197,Tiruchirappalli,Tamil Nadu,Religious,Rock Fort Temple,Air/Rail/Road,Tiruchirappalli Airport,Tiruchirappalli Junction,Tiruchirappalli is a place in Tamil Nadu where the Rock Fort Temple is located.,"temple visits, spiritual activities",medium,All year
198,198,Vellore,Tamil Nadu,Heritage,Vellore Fort,Rail/Road,Chennai International Airport,Vellore Cantonment,Vellore Fort is a fort in Tamil Nadu.,"monument visits, cultural tours",medium,October to March
199,199,Yercaud,Tamil Nadu,Mountains,Emerald Lake,Road,Tiruchirappalli Airport,Salem Junction,Yercaud is a small town in the Tamil Nadu state of Tamil Nadu. It is located on the banks of the Emerald Lake.,"trekking, hiking, camping, snow activities",medium,March to June
200,200,Hogenakkal,Tamil Nadu,Nature,Hogenakkal Falls,Road,Bangalore International Airport,Dharmapuri Railway Station,Hogenakkal is a village in the Tamil Nadu state of Tamil Nadu. It is located on the banks of the Hogenakkal River.,"sightseeing, photography, relaxation",medium,October to March
201,201,Kumarakom,Kerala,Nature,Kumarakom Bird Sanctuary,Road,Cochin International Airport,Kottayam Railway Station,Kumarakom is a bird sanctuary in Kerala.,"sightseeing, photography, relaxation",high,October to March
202,202,Bekal,Kerala,Heritage,Bekal Fort,Rail/Road,Mangalore International Airport,Kasaragod Railway Station,Bekal Fort is a fort located in the northern part of Kerala.,"monument visits, cultural tours",high,October to March
203,203,Thrissur,Kerala,Heritage,Vadakkunnathan Temple,Rail/Road,Cochin International Airport,Thrissur Railway Station,"Thrissur is a city in Kerala, India. It is the capital of the state of Kerala. The city is the home of the Vadakkunnathan Temple.","monument visits, cultural tours",high,October to March
204,204,Palakkad,Kerala,Heritage,Palakkad Fort,Rail/Road,Coimbatore International Airport,Palakkad Junction,Palakkad Fort is a fort located in the southern part of Kerala.,"monument visits, cultural tours",high,October to March
205,205,Kannur,Kerala,Heritage,St. Angelo Fort,Air/Rail/Road,Kannur International Airport,Kannur Railway Station,Kannur is a city in the state of Kerala. The city is famous for its St. Angelo Fort.,"monument visits, cultural tours",high,October to March
206,206,Sasan Gir,Gujarat,Nature,Gir Wildlife Sanctuary,Road,Rajkot Airport,Junagadh Railway Station,Sasan Gir is a wildlife sanctuary in Gujarat.,"sightseeing, photography, relaxation",low,October to March
207,207,Champaner,Gujarat,Heritage,Champaner-Pavagadh UNESCO Site,Road,Vadodara Airport,Vadodara Junction,"Champaner is a city in Gujarat, India. It is located on the banks of the Champaner River. The Champaner-Pavagadh UNESCO Site is a UNESCO World Heritage Site.","monument visits, cultural tours",low,October to March
208,208,Modhera,Gujarat,Heritage,Sun Temple Modhera,Road,Sardar Vallabhbhai Patel International Airport,Mehsana Railway Station,The Sun Temple is a temple in Gujarat.,"monument visits, cultural tours",low,October to March
209,209,Lothal,Gujarat,Heritage,Harappan Archaeological Site,Road,Sardar Vallabhbhai Patel International Airport,Lothal Bhurkhi Railway Station,The Lothal is a UNESCO World Heritage Site in Gujarat.,"monument visits, cultural tours",low,October to March
210,210,Mandvi,Gujarat,Beach,Mandvi Beach,Road,Bhuj Airport,Bhuj Railway Station,Mandvi is a popular tourist destination in Gujarat. It is located in the north of the city and is a popular tourist destination.,"swimming, sunbathing, water sports, nightlife",low,November to February
211,211,Porbandar,Gujarat,Heritage,Kirti Mandir,Air/Rail/Road,Porbandar Airport,Porbandar Railway Station,The Kirti Mandir is a temple in the city of Porbandar in Gujarat.,"monument visits, cultural tours",low,October to March
212,212,Patan,Gujarat,Heritage,Rani ki Vav,Road,Sardar Vallabhbhai Patel International Airport,Patan Railway Station,Patan is a popular tourist destination in Gujarat. It is located in the heart of the city and is a popular place to visit for its Rani ki Vav.,"monument visits, cultural tours",low,October to March
213,213,Mount Abu,Rajasthan,Mountains,Dilwara Temples,Rail/Road,Maharana Pratap Airport,Abu Road Railway Station,Mount Abu is a popular tourist spot in Rajasthan. It is located on the banks of the River Jaipur and is the site of the Dilwara Temple.,"trekking, hiking, camping, snow activities",medium,March to June
214,214,Alwar,Rajasthan,Heritage,Alwar City Palace,Rail/Road,Jaipur International Airport,Alwar Junction,"Alwar is a city in Rajasthan, India. It is located in the heart of the city and is the home of the Alwar City Palace.","monument visits, cultural tours",medium,October to March
215,215,Sariska,Rajasthan,Nature,Sariska Tiger Reserve,Road,Jaipur International Airport,Alwar Junction,"Sariska is a small town in Rajasthan, India. It is the home of the Sariska Tiger Reserve.","sightseeing, photography, relaxation",medium,October to March
216,216,Barmer,Rajasthan,Heritage,Kiradu Temples,Rail/Road,Jodhpur Airport,Barmer Railway Station,"Barmer is a city in Rajasthan, India. It is located in the north of the city, near the Kiradu Temple. The city is famous for its temples and the Kiradu Temple.","monument visits, cultural tours",medium,October to March
217,217,Kota,Rajasthan,Heritage,Chambal Garden,Rail/Road,Kota Airport,Kota Junction,Kota is a small village in the Rajasthan state of Rajasthan. It is located on the banks of the River Jaipur. The village is famous for its Chambal Garden.,"monument visits, cultural tours",medium,October to March
218,218,Sikar,Rajasthan,Heritage,Khatu Shyamji Temple,Road,Jaipur International Airport,Sikar Road,Sikar is a small village in the Rajasthan state of Rajasthan. It is located on the banks of the Khatu River. The village is a popular tourist destination.,"monument visits, cultural tours",medium,October to March
219,219,Mandawa,Rajasthan,Heritage,Shekhawati Frescoes,Road,Jaipur International Airport,Loharu Railway Station,The Mandawa is a small town in the Rajasthan state of Rajasthan. It is famous for its Shekhawati Frescoes.,"monument visits, cultural tours",medium,October to March
220,220,Karauli,Rajasthan,Religious,Kaila Devi Temple,Road,Jaipur International Airport,Hindaun City Railway Station,The Kaila Devi Temple is a temple in the Rajasthan state of Rajasthan.,"temple visits, spiritual activities",medium,All year
221,221,Nagaur,Rajasthan,Heritage,Nagaur Fort,Road,Jodhpur Airport,Nagaur Railway Station,Nagaur Fort is a fort in the Rajasthan state of Rajasthan.,"monument visits, cultural tours",medium,October to March
222,222,Sawai Madhopur,Rajasthan,Nature,Ranthambore Fort,Rail/Road,Jaipur International Airport,Sawai Madhopur Junction,"Sawai Madhopur is a city in Rajasthan, India. It is located in the Ranthambore district. The city is famous for its Ranthambore Fort.","sightseeing, photography, relaxation",medium,October to March
223,223,Siliguri,West Bengal,Nature,Mahananda Wildlife Sanctuary,Air/Rail/Road,Bagdogra Airport,New Jalpaiguri,"Siliguri is a village in the district of Siliguri, West Bengal, India. It is located on the banks of the Mahananda River. The village is a popular tourist destination.","sightseeing, photography, relaxation",low,October to March
224,224,Kalimpong,West Bengal,Mountains,Deolo Hill,Road,Bagdogra Airport,New Jalpaiguri,"Kalimpong is a village in the district of Kalimpong, West Bengal. It is located on the banks of the Deolo River.","trekking, hiking, camping, snow activities",low,March to June
225,225,Cooch Behar,West Bengal,Heritage,Cooch Behar Palace,Rail/Road,Bagdogra Airport,Cooch Behar Railway Station,Cooch Behar is a city in the West Bengal state of West Bengal. It is located on the banks of the River Cooch and is the home of the Cooch Behar Palace.,"monument visits, cultural tours",low,October to March
226,226,Purulia,West Bengal,Nature,Ajodhya Hills,Rail/Road,Netaji Subhas Chandra Bose International Airport,Purulia Junction,Purulia is a village in the Ajodhya Hills district of West Bengal.,"sightseeing, photography, relaxation",low,October to March
227,227,Shantiniketan,West Bengal,Heritage,Visva Bharati University,Rail/Road,Netaji Subhas Chandra Bose International Airport,Bolpur Shantiniketan,"The Visva Bharati University is located in Shantiniketan, West Bengal.","monument visits, cultural tours",low,October to March
228,228,Bakkhali,West Bengal,Beach,Bakkhali Beach,Road,Netaji Subhas Chandra Bose International Airport,Namkhana Railway Station,"Bakkhali is a village in the district of Kota, West Bengal, India. It is located on the banks of the Kota River. The village is a popular tourist destination.","swimming, sunbathing, water sports, nightlife",low,November to February
229,229,Jaldapara,West Bengal,Nature,Jaldapara Wildlife Sanctuary,Road,Bagdogra Airport,Alipurduar Junction,Jaldapara is a village in the Jaldapara district of West Bengal. It is located on the banks of the Jaldapara River. The Jaldapara Wildlife Sanctuary is a wildlife sanctuary.,"sightseeing, photography, relaxation",low,October to March
230,230,Gokarna,Karnataka,Beach,Om Beach,Rail/Road,Hubli Airport,Gokarna Road Railway Station,Gokarna is a popular tourist destination in Karnataka. The beach is located in the north of the city.,"swimming, sunbathing, water sports, nightlife",medium,November to February
231,231,Chikmagalur,Karnataka,Nature,Mullayanagiri Peak,Road,Mangalore International Airport,Kadur Railway Station,The Mullayanagiri Peak is a mountain peak in the Karnataka state of Karnataka.,"sightseeing, photography, relaxation",medium,October to March
232,232,Murudeshwar,Karnataka,Religious,Murudeshwar Temple,Rail/Road,Mangalore International Airport,Murudeshwar Railway Station,"The Murudeshwar Temple is a temple in the city of Murudeshwar, Karnataka.","temple visits, spiritual activities",medium,All year
233,233,Dandeli,Karnataka,Adventure,Kali River Rafting,Road,Hubli Airport,Dharwad Railway Station,Dandeli is a riverside resort in Karnataka. It is located on the banks of the Kali River.,"rafting, trekking, camping, skiing",medium,March to June
234,234,Kabini,Karnataka,Nature,Nagarhole National Park,Road,Mysore Airport,Mysuru Junction,Kabini is a village in the Nagarhole National Park in Karnataka.,"sightseeing, photography, relaxation",medium,October to March
235,235,Bidar,Karnataka,Heritage,Bidar Fort,Road,Rajiv Gandhi International Airport,Bidar Railway Station,Bidar Fort is a fort in Karnataka.,"monument visits, cultural tours",medium,October to March
236,236,Gulbarga,Karnataka,Heritage,Gulbarga Fort,Rail/Road,Rajiv Gandhi International Airport,Gulbarga Railway Station,Gulbarga Fort is a fort in Karnataka.,"monument visits, cultural tours",medium,October to March
237,237,Mangalore,Karnataka,Heritage,Kadri Manjunath Temple,Air/Rail/Road,Mangalore International Airport,Mangalore Central,Mangalore is a city in Karnataka state. It is the capital of Karnataka state. The Kadri Manjunath Temple is a temple in the city.,"monument visits, cultural tours",medium,October to March
238,238,Karwar,Karnataka,Beach,Devbagh Beach,Rail/Road,Dabolim Airport,Karwar Railway Station,Karwar is a popular tourist destination in Karnataka. It is located in the north of Karnataka and is a popular tourist destination.,"swimming, sunbathing, water sports, nightlife",medium,November to February
239,239,Ratnagiri,Maharashtra,Heritage,Thibaw Palace,Rail/Road,Ratnagiri Airport,Ratnagiri Railway Station,"The Thibaw Palace is a major tourist attraction in Ratnagiri, Maharashtra.","monument visits, cultural tours",medium,October to March
240,240,Alibaug,Maharashtra,Beach,Kolaba Fort,Road,Chhatrapati Shivaji Maharaj International Airport,Roha Railway Station,"Alibaug is a city in Maharashtra, India. It is located in the north of the city. The Kolaba Fort is a fort.","swimming, sunbathing, water sports, nightlife",medium,November to February
241,241,Matheran,Maharashtra,Mountains,Echo Point,Rail/Road,Pune Airport,Matheran Railway Station,The Matheran is a small town in the Maharashtra state of Maharashtra. It is located on the banks of the River Ganges. The town is famous for its famous Echo Point.,"trekking, hiking, camping, snow activities",medium,March to June
242,242,Panchgani,Maharashtra,Mountains,Table Land Plateau,Road,Pune Airport,Wathar Railway Station,Panchgani is a village in the Panchgani district of Maharashtra. It is located on the banks of the River Panchgani. The village is located on the banks of the River Panchgani.,"trekking, hiking, camping, snow activities",medium,March to June
243,243,Tarkarli,Maharashtra,Beach,Scuba Diving Spot,Road,Ratnagiri Airport,Kudal Railway Station,The Scuba Diving Spot is a popular tourist spot in Maharashtra.,"swimming, sunbathing, water sports, nightlife",medium,November to February
244,244,Mahaad,Maharashtra,Religious,Ashtavinayak Temple Siddhatek,Road,Pune Airport,Mangaon Railway Station,"Mahaad is a village in Maharashtra state, India. It is located on the banks of the River Siddhatek. The temple is located in the village of Mahaad.","temple visits, spiritual activities",medium,All year
245,245,Wai,Maharashtra,Heritage,Ganpati Temple,Road,Pune Airport,Wathar Railway Station,Wai is a village in the Maharashtra state of Maharashtra. It is located on the banks of the River Ganges. The village is a popular tourist destination. The Ganpati Temple is a temple in the village of Wai.,"monument visits, cultural tours",medium,October to March
246,246,Trimbak,Maharashtra,Religious,Trimbakeshwar Temple,Road,Ozar Airport,Nashik Road,"Trimbak is a village in the district of Trimbak, in Maharashtra. It is located on the banks of the River Ganges. The temple is located on the banks of the River Ganges.","temple visits, spiritual activities",medium,All year
247,247,Murud-Janjira,Maharashtra,Heritage,Janjira Sea Fort,Road,Chhatrapati Shivaji Maharaj International Airport,Roha Railway Station,The Janjira Sea Fort is a fort located in the north of the city of Murud-Janjira.,"monument visits, cultural tours",medium,October to March
248,248,Igatpuri,Maharashtra,Nature,Casvita Lake,Rail/Road,Ozar Airport,Igatpuri Railway Station,"Igatpuri is a village in the district of Igatpuri, Maharashtra. It is located on the banks of Casvita Lake.","sightseeing, photography, relaxation",medium,October to March
249,249,Ashtamudi Lake,Kerala,Nature,Ashtamudi Wetland,Rail/Road,Trivandrum International Airport,Kollam Junction,Ashtamudi Lake is a lake in the Ashtamudi district of Kerala. It is located on the banks of the Ashtamudi River.,"sightseeing, photography, relaxation",high,October to March
250,250,Sabarimala,Kerala,Religious,Ayyappa Temple,Road,Cochin International Airport,Kottayam Railway Station,Sabarimala is a popular tourist destination in Kerala. It is located in the north of the state and is a popular tourist destination. The Ayyappa Temple is a temple located in the north of the state.,"temple visits, spiritual activities",high,All year
251,251,Athirappilly,Kerala,Nature,Athirappilly Falls,Road,Cochin International Airport,Chalakudy Railway Station,"Athirappilly is a village in the district of Athirappilly, Kerala, India. It is located on the banks of the Athirappilly River. The Athirappilly Falls are a waterfall in the district.","sightseeing, photography, relaxation",high,October to March
252,252,Kalpetta,Kerala,Nature,Chembra Peak,Road,Calicut International Airport,Kozhikode Railway Station,The Chembra Peak is a peak in the Himalayan region of Kerala.,"sightseeing, photography, relaxation",high,October to March
253,253,Lakkidi,Kerala,Nature,Vythiri Mountain Resort Area,Road,Calicut International Airport,Kozhikode Railway Station,The Vythiri Mountain Resort Area is a mountain resort area in Kerala.,"sightseeing, photography, relaxation",high,October to March
254,254,Chikhaldhara,Maharashtra,Mountains,Chikhaldara Hill Station,Road,Amravati Airport,Amravati Railway Station,"Chikhaldara Hill Station is a railway station in the city of Chikhaldara, Maharashtra.","trekking, hiking, camping, snow activities",medium,March to June
255,255,Nagpur,Maharashtra,Heritage,Deekshabhoomi,Air/Rail/Road,Dr. Babasaheb Ambedkar International Airport,Nagpur Junction,"Nagpur is a city in Maharashtra, India. It is the capital of Nagpur district. The city is famous for its Deekshabhoomi temple.","monument visits, cultural tours",medium,October to March
256,256,Wardha,Maharashtra,Heritage,Sevagram Ashram,Rail/Road,Dr. Babasaheb Ambedkar International Airport,Wardha Junction,"The Wardha is a village in the district of Wardha, in the Indian state of Maharashtra. It is located on the banks of the Sevagram river. The village is a popular tourist destination.","monument visits, cultural tours",medium,October to March
257,257,Tadoba,Maharashtra,Nature,Tadoba Tiger Reserve,Road,Dr. Babasaheb Ambedkar International Airport,Chandrapur Railway Station,"Tadoba is a village in the district of Tadoba, in Maharashtra. The village is located on the banks of the Tadoba River. The Tadoba Tiger Reserve is a wildlife reserve in the state of Maharashtra.","sightseeing, photography, relaxation",medium,October to March
258,258,Amravati,Maharashtra,Heritage,Ambadevi Temple,Air/Rail/Road,Amravati Airport,Amravati Railway Station,"Amravati is a city in Maharashtra, India. Amravati is the capital city of Amravati. Amravati is the capital city of Maharashtra. Amravati is the capital city of Maharashtra.","monument visits, cultural tours",medium,October to March
259,259,Jawhar,Maharashtra,Nature,Shirpamal Point,Road,Chhatrapati Shivaji Maharaj International Airport,Dahanu Road Railway Station,"Jawhar is a city in Maharashtra, India. It is located on the banks of the Shirpamal River. The city is famous for its temples and shrines.","sightseeing, photography, relaxation",medium,October to March
260,260,Pandharpur,Maharashtra,Religious,Vitthal Rukmini Temple,Rail/Road,Solapur Airport,Pandharpur Railway Station,"The temple is located in the village of Pandharpur, which is a popular tourist destination. The temple is located in the village of Pandharpur, which is a popular tourist destination in Maharashtra.","temple visits, spiritual activities",medium,All year
261,261,Solapur,Maharashtra,Heritage,Siddheshwar Temple,Air/Rail/Road,Solapur Airport,Solapur Junction,"The Siddheshwar Temple is located in Solapur, Maharashtra.","monument visits, cultural tours",medium,October to March
262,262,Karad,Maharashtra,Heritage,Priyadarshini Park,Rail/Road,Kolhapur Airport,Karad Railway Station,"Priyadarshini Park is a park in Karad, Maharashtra.","monument visits, cultural tours",medium,October to March
263,263,Satara,Maharashtra,Heritage,Ajinkyatara Fort,Rail/Road,Pune Airport,Satara Railway Station,"Satara is a city in Maharashtra, India. It is the location of Ajinkyatara Fort.","monument visits, cultural tours",medium,October to March
264,264,Latur,Maharashtra,Heritage,Udgir Fort,Rail/Road,Latur Airport,Latur Railway Station,The Udgir Fort is a fort in the Maharashtra state of Maharashtra.,"monument visits, cultural tours",medium,October to March
265,265,Jalna,Maharashtra,Heritage,Jalna Fort,Rail/Road,Aurangabad Airport,Jalna Railway Station,Jalna Fort is a fort in the Jalna district of Maharashtra.,"monument visits, cultural tours",medium,October to March
266,266,Bhusawal,Maharashtra,Heritage,Rajas Falls,Rail/Road,Aurangabad Airport,Bhusawal Junction,Bhusawal is a village in the Rajas district of Maharashtra. It is located on the banks of the Rajas River.,"monument visits, cultural tours",medium,October to March
267,267,Nanded,Maharashtra,Religious,Hazur Sahib Gurudwara,Air/Rail/Road,Nanded Airport,Nanded Railway Station,"Nanded is a village in the district of Maharashtra, India. It is located on the banks of the Hazur River. The village is famous for its Hazur Sahib Gurudwara.","temple visits, spiritual activities",medium,All year
268,268,Osmanabad,Maharashtra,Heritage,Terna Fort,Road,Solapur Airport,Osmanabad Railway Station,The Terna Fort is a fort in the city of Osmanabad in Maharashtra.,"monument visits, cultural tours",medium,October to March
269,269,Alibag,Maharashtra,Beach,Alibag Beach,Road,Chhatrapati Shivaji Maharaj International Airport,Pen Railway Station,Alibag is a popular tourist destination in Maharashtra. It is located in the north of the city and is a popular tourist destination.,"swimming, sunbathing, water sports, nightlife",medium,November to February
270,270,Hrishikesh,Uttarakhand,Adventure,River Rafting on Ganga,Rail/Road,Jolly Grant Airport,Haridwar Junction,Hrishikesh is a riverside resort in Uttarakhand. It is located on the Ganga River.,"rafting, trekking, camping, skiing",medium,March to June
271,271,Pithoragarh,Uttarakhand,Mountains,Pithoragarh Fort,Air/Road,Pithoragarh Airport,Tanakpur Railway Station,Pithoragarh Fort is a fort in Uttarakhand.,"trekking, hiking, camping, snow activities",medium,March to June
272,272,Almora,Uttarakhand,Mountains,Kasar Devi Temple,Road,Pantnagar Airport,Kathgodam Railway Station,The Kasar Devi Temple is a temple in the district of Almora in Uttarakhand.,"trekking, hiking, camping, snow activities",medium,March to June
273,273,Ranikhet,Uttarakhand,Mountains,Chaubatia Gardens,Road,Pantnagar Airport,Kathgodam Railway Station,The Chaubatia Gardens are a popular tourist attraction in Uttarakhand.,"trekking, hiking, camping, snow activities",medium,March to June
274,274,Chamoli,Uttarakhand,Religious,Gopinath Temple,Road,Jolly Grant Airport,Haridwar Junction,"Chamoli is a village in the district of Gopinath, in the Indian state of Uttarakhand. The village is located on the banks of the Ganges River.","temple visits, spiritual activities",medium,All year
275,275,Chakrata,Uttarakhand,Nature,Tiger Falls,Road,Jolly Grant Airport,Dehradun Railway Station,Chakrata is a village in the Uttarakhand state of Uttar Pradesh. It is located on the banks of the Ganges River. The village is located on the banks of the Ganges River. The village is located on the banks of the Ganges River.,"sightseeing, photography, relaxation",medium,October to March
276,276,Munsiyari,Uttarakhand,Mountains,Milam Glacier,Road,Pithoragarh Airport,Tanakpur Railway Station,"Munsiyari is a village in the district of Munsiyari, Uttarakhand. The village is located on the banks of the Milam Glacier.","trekking, hiking, camping, snow activities",medium,March to June
277,277,Chamba,Himachal Pradesh,Heritage,Chamba Chaugan,Road,Kangra Airport,Pathankot Junction,Chamba is a village in Himachal Pradesh state in India. It is located on the banks of the Ganges River. Chamba Chaugan is a village in Chamba.,"monument visits, cultural tours",medium,October to March
278,278,Palampur,Himachal Pradesh,Nature,Neugal Khad,Road,Gaggal Airport,Pathankot Junction,Palampur is a village in the Himachal Pradesh state of Himachal Pradesh. It is located on the banks of the River Ganges. The village is a popular tourist destination.,"sightseeing, photography, relaxation",medium,October to March
279,279,Kangra,Himachal Pradesh,Religious,Kangra Devi Temple,Air/Road,Gaggal Airport,Kangra Mandir Railway Station,Kangra Devi Temple is a temple in Himachal Pradesh.,"temple visits, spiritual activities",medium,All year
280,280,Mandi,Himachal Pradesh,Religious,Bhutnath Temple,Road,Kullu Manali Airport,Joginder Nagar Railway Station,Mandi is a village in the Himachal Pradesh state of Himachal Pradesh. It is located on the banks of the Bhutnath river. The Bhutnath Temple is a temple located in the village of Mandi.,"temple visits, spiritual activities",medium,All year
281,281,Nahan,Himachal Pradesh,Nature,Suketi Fossil Park,Road,Chandigarh Airport,Nahan Railway Station,The Nahan is a small village in the Himachal Pradesh state of Himachal Pradesh. It is located on the banks of the Suketi River. The village is a popular tourist destination.,"sightseeing, photography, relaxation",medium,October to March
